id,name,taxa_kind_id_name,description,col_id,eol_id,Sinonimi,Autore,Etimologia,"Tipo di vegetazione","Diffusione geografica","Nome italiano",Fioritura,Altezza,"Inizio fioritura","Fine fioritura"
693231,"Glaucium flavum",Specie,"Pianta bienne, talora perennante, completamente glabra e di colore glauco; foglie più o meno tutte lobato-partite o lirate, carnosette; scapi fiorali di 50-70 cm, con fiori di 3-4 cm di ⌀, terminali, a quattro petali gialli, stami gialli; frutto di 20 cm di lunghezza che maturando si allunga in una particolare capsula lineare, simile a una siliqua, con semi posti su un setto.<br /><br />Un tempo aveva impiego medicinale, ma tutte le parti della pianta, in particolare la radice, sono velenose<br /><br /><em>G. comiculatum</em> J. Rudolf è rara infestante dell'Europa meridionale; si distingue dalla precedente perché è pelosa e ha fiori aranciati.",df52718273f03dd4307bd7a905b10d9b,483314,"(= G. luteum Scop)",Crantz,"Il nome di questa pianta deriva dai greco glaucós= verde-azzurro e dal latino flavum= giallo, per il","La specie è diffusa sulle sabbie, i litorali marini e negli ambienti ruderali.","Coste e centro Europa.","Papavero cornuto",,,Maggio,Ottobre
1005230,"Fumaria officinalis",Specie,"Pianta annua, a portamento rampante-eretto, ramificata: foglie finemente pennatosetto e lunghe infiorescenze racemose di fiori di 5 mm, di colore violetto ad unico piano di simmetria; il petalo superiore è speronato e chiude i due laterali e quello inferiore; frutto non deiscente ad achenio.<br /><br />Questa pianta, di antico uso nella medicina popolare, ha proprietà toniche, depurative, aperitive e il suo sapore è amaro. Le api ne raccolgono il polline.<br />Simile alla precedente è <em>F. vaillantii</em> Loisel., con corolla rosata di 5-6 mm; diffusa in tutta 'Europa continentale, soprattutto nei campi di cereali.",fd91411954de5acce7cd5ae22c259944,590512,,Linneo,"Il genere prende il nome dal latino fumus, per l'aspetto nebuloso, simile a fumo, delle foglie grigi","Comune come infestante nei campi, vigneti, negli incolti, lungo i cigli delle strade e nei ruderi fi","È diffusa in tutta Europa, dalla pianura fino a 900 m.","Fumaria; Fumosterno; Feccia",,,Aprile,Ottobre
1023229,"Fumaria capreolata",Specie,"Simile alla precedente, ma con corolla color crema e fauce violetta.<br /><br />Simile a questa è <em>F. parviflora</em> Lam., con corolla biancastra ad apice scuro, lunga poco più di 0,5 cm; diffusa nei campi di cereali dell'Europa meridionale.",a004738750608c7fb655ec98bfe93d28,487222,,Linneo,"Il nome specifico fa riferimento alle infiorescenze divise come corna.","È pianta infestante di campi, orti e vigne, ruderale e nitrofila.","Pianta propria dell'Europa occidentale e meridionale.","Fumaria bianca",,,Aprile,Ottobre
562226,"Ranunculus parviflorus",Specie,"Pianta annua, alta fino a 30 cm, più o meno pubescente, con caratteristiche foglie palmato-rotonde divise in cinque lobi; fiori di 5 mm di ⌀, gialli; acheni uncinati all'apice.",e41dc09ab8b15f7afa6e44f9990f257f,596381,,Linneo,,"Pianta presente negli ambienti con terreni argillosi subacidi, campi e vigneti.","Diffusa nelle regioni mediterranee e atlantiche d'Europa fino alla Gran Bretagna.","Ranuncolo a piccoli fiori",,,Marzo,Maggio
476225,"Ranunculus acris",Specie,"Pianta perenne per breve rizoma biforcato, alta fino a 1 m; foglie palmate profondamente e più volte divise; fusti fiorali in cime lasse, con fiori di 2 cm di ⌀ a petali giallo-dorati, lucidi; frutti ad achenio in infruttescenza sferica.<br /><br />Specie simile si deve considerare <em>R. friesianus</em> Jord., proprio delle zone montuose, con rizoma molto lungo e foglie a segmenti poco distanziati.",82d636fee1a0b4e6850b919a71f07a9e,473796,,Linneo,,"Prati, pascoli, ambienti ruderali, su terreni freschi fino a 1500 m.","Comune in tutta Europa, salvo che nella regione mediterranea.","Ranuncolo comune, pie di nibbio, pie di gallina",,,Maggio,Agosto
688224,"Ranunculus repens",Specie,"Pianta perenne, stolonifera, radicante ai nodi, con fusti spesso arrossati, rampanti eretti; foglie trifogliate, lobato-partite, più o meno lucide, glabre; fiori di 2 cm di ⌀, gialli; acheni lisci in infruttescenza sferica.<br /><br />È pianta velenosa.",2b14d7da24302a0ea52275ae01dee5dd,594867,,Linneo,,"Prati umidi e sponde dei fossati, bordi di stagni, campi, giardini, ambienti ruderali, dalla pianura","Diffusa ovunque.","Ranuncolo strisciante",,,Marzo,Agosto
501223,"Ranunculus sardous",Specie,,,,,,,,,,,,,
45222,"Ranunculus bulbosus",Specie,"Pianta perenne, con fusto ingrossato simile a un bulbo alla base, bianco; foglie trifogliate, lobato-partite; fiori di 2 om di ⌀ a sepali riflessi (piegati in basso); frutti ad acheni lisci in infruttescenza sferica; nel complesso la pianta si presenta pelosa<br /><br />Pianta velenosa. Simile, ma di solito senza ingrossamento a bulbo, è <em>R. sardous</em> Crantz. che vegeta nei luoghi umidi e fangosi e infesta le praterie umide di quasi tutta Europa.",e425457c953b5f5a8f3aaf423978abaa,473783,,Linneo,,"Prati aridi, campi e luoghi incolti, dalla pianura alla zona montana; infestante nei pascoli.","Comune in tutto il centro e nord Europa, con numerose sottospecie nell'area mediterranea.","Ranuncolo bulboso",,,Marzo,Ottobre
768221,"Ranunculus arvensis",Specie,"Pianta annua, di 30 cm, fusti pelosi e foglie non palmate, ma irregolarmente e profondamente diviso in tre lobi, fiori di circa 1 cm di ⌀ giallo chiaro; acheni grandi, incurvati e distintamente spinescenti<br /><br />Gli acheni inquinano le granaglie, in quanto tossici.",08adba04cdfd25f35e608e61f727b44a,473790,,Linneo,,"Infestante dei cereali e comune negli incolti aridi fino oltre i 1000 m di altitudine.","Diffusa in Europa, salvo a nord.","Ranuncolo dei campi",,,Aprile,Giugno
519220,"Ranunculus sceleratus",Specie,"Pianta annua, alta fino a 50 cm; fusti fiorali ramosi, con foglie basali trilobe più o meno incise; foglie caulinari polimorfe, in alto più o meno semplici, lanceolate. Fiori piccoli (meno di 1 cm) numerosi; acheni in infruttescenze caratteristiche, cilindrico-allungate.<br /><br />Durante i periodi di carestia le foglie giovani, che da fresche sono molto tossiche, si consumavano dopo cottura. Il principio attivo velenoso, contenuto in tutta la pianta, è presente soprattutto nei fiori: ingerito, provoca gravi disturbi agli apparati digerente, respiratorio e circolatorio, e può causare spesso la morte. Il succo è vescicatorio. Il veleno produce una caratteristica contrazione alla bocca e agli occhi, dal che deriva il detto 'risata sardonica': i romani infatti chiamavano la pianta sardonia, ritenendola originaria della Sardegna.",9ccecd392388335f419da4f20741c6e6,473809,,,,"Ambienti umidi su suoli argilloso-limosi, dalla pianura ai 1000 m","Presente quasi in tutta Europa.","Ranuncolo tossico, sardonia",,,Maggio,Giugno
1072219,"Anemone hortensis",Specie,"Pianta perenne, con piccoli tuberi legnosi, nerastri; foglie basali palmato-lobate, foglie degli steli fiorali lineari, verticillate; fiori con numerosi petali lanceolati, rosa-azzurrini,<br /><br />Coltivata come ornamentale in diverse varietà; è pianta velenosa.",ecab40352de6700f9103c03fe2c447b8,,"(= A. stellata Lam.)",Linneo,,"Campi, vigne, prati e pascoli magri, boscaglie luminose.","Regione mediterranea centrale d'Europa.","Anemone fior di stella",,,Marzo,Maggio
506218,"Anemone coronaria",Specie,"Pianta perenne, con fusto sotterraneo rigonfio a tubero; foglie basali alternate, sette e lobate, foglie dei fusti fiorali profondamente divise; calice assente; petali 5-8 grandi e fiori solitari di 4-6 cm di diametro, di solito rossi, talora azzurri o bianchi. Frutti ad achenio piumoso.<br /><br />Coltivata e moltiplicata per tuberi (zampe) in numerose varietà e tinte prende anche il nome, di anemone di Caen. La pianta è velenosa.",d51e1f8bbedde780b8af3de869bc3114,596416,,Linneo,"II nome specifico sottolinea l'uso che se ne faceva per corone celebrative; quello del genere si pen","Incolti e oliveti nella regione mediterranea.","Europa mediterranea","Anemone dei fiorai",,,Gennaio,Marzo
729217,"Pulsatilla vulgaris",Specie,"Pianta perenne, rizomatosa, con foglie bipen-natosetìe, all'inizio completamente grigio-sericee; foglie dei fusti fiorali fuse alla base e divise in lacinie; fiori grandi, di 5-7 cm di ⌀, campanulati e più o meno reclinati, fuori grigio-sericei, dentro violetti; petali acuti e stami gialli; frutto ad achenio piumoso.<br /><br />Coltivata come ornamentale nei giardini rocciosi; è pianta velenosa.<br /><br />Presenta diverse sottospecie e popolazioni spesso isolate. In Italia centro-settentrionale è presente <em>P. montana</em> Rchb,, con petali violetto scuro.",356460beb7c14d9efa51c4f3a7d0c75f,485245,"( = Anemone pulsatilla L.)",Mill.,"Il nome del genere deriva dal latino pulsare, per il caratteristico dondolio del fiore nel vento.","Prati aridi, margine di pinete e querceti; dal piano fino a 1000 m. di altitudine.","Diffusa nella fascia centrale europea, comprese Inghilterra e Svezia.",Pulsatilla,,,Aprile,Maggio
966216,"Eranthis hiemalis",Specie,"Pianta perenne, con breve rizoma ingrossato; loglie palmate, rotonde; fiori grandi 2-3 cm con numerosi (6) petali gialli, che sono addossati alle foglie cauline simulanti un grande calice lobato.<br /><br />Questa specie viene coltivata come ornamentale a causa della sua fioritura precoce e vistosa; pianta velenosa.",ab3558b0c0eb7d59a82c88d7d4cceaf7,594849,,"(L.) Salisb.","Il nome del genere deriva dal greco er= primavera, ànthos= fiore, per la precoce fioritura; hiemalis","Campi, vigneti, siepi.","Europa meridionale, dalla Francia alla Penisola Balcanica.","Piè di gallo",,,Febbraio,Marzo
630215,"Trollius europaeus",Specie,"Pianta perenne, rizomatosa, con foglie palmatosette più o meno tobato-dentate; fiori globosi, terminali, di 4-5 cm di ⌀, a petali gialli; frutti dati da un insieme di follicoli.<br /><br />Pianta velenosa, viene coltivata come ornamentale in varietà a fiori doppi.",fb0d94ee8bb807c524ff1334490a3420,596364,,Linneo,"Il nome del genere, dall'antico tedesco <em>trol</em>, significa 'globoso', per la forma del fiore","Prati e pascoli umidi e pingui","Nell'Europa meridionale è una pianta esclusiva delle zone montane; diffusa nel resto del continente.","Botton d'oro",,,Giugno,Agosto
620214,"Caltha palustris",Specie,"Pianta perenne, con grandi foglie rotondeggianti cordate; fusti fiorali appena ramificati, con foglie subsessili; fiore a 5-6 petali color giallo uovo brillante, con molti stami, del diametro complessivo di 3-4 cm. Frutti a follicolo.<br /><br />Utilizzata come pianta ornamentale al bordo degli stagni. I fiori, essiccati e mescolati con reagenti adatti, forniscono una tinta gialla. Pianta velenosa.",3bbf36346016fc293638dfb2098e7683,596646,,Linneo,"La forma del fiore a coppetta, in greco kàla-zos, ha dato il nome al genere.","Ambienti umidi e inondati dal piano allazona montana; vive nei prati falciati e nei fossi.","Europa alpina e centro-settentrionale",Calta,,,Maggio,Giugno
717213,"Ranunculus ficaria",Specie,"Pianta perenne, con radice tuberosa; foglie cuoriformi in rosetta basale e scapi fiorali di 10 cm, con fiori di 3-4 cm di ⌀, gialli, a otto petali ucidi, sepali tre. Frutto ad achenio.<br /><br />Talvolta si utilizzavano le foglie sbiancate (cresciute ai buio) come insalata, La pianta ha proprietà vescicatorie e antiemorragiche, ma si tratta di rimedi pericolosi perché è velenosa. Le sostanze tossiche sembra non si formino nell'oscurità. Fiori visitati dalle api.",d1a95ae56713a109e10ce964d4440416,473789,"(= Ficaria verna Huds.)",Linneo,"Ficaria sta ad intendere che la radice ha la forma di un piccolo fico.","Luoghi umidi ombrosi, fossi, campi e siepi.","Comune in tutta Europa",Favagello,,,Gennaio,Maggio
752212,"Adonis aestivalis",Specie,"Pianta annua, di 20-40 cm, a foglie tripennatosette; fiori di 3 cm di ⌀, terminali, a otto petali rossi con macchie scure alla base e sepali aderenti ai petali; frutto ad achenio.<br /><br />Coltivata ornamentale con diverse varietà a fiori doppi.<br /><br />Nell'Europa meridionale, negli stessi ambienti è presente <em>A. annua</em> L. (= <em>A. autumnalis</em> L.) che si distingue dalla precedente per i fiori di color rosso brillante leggermente più piccoli e i sepali piegati verso il peduncolo; propria dell'Europa meridionale è invece <em>A. flammea</em> Jacq.t più rara, con calice peloso.",664fe72ead89d35007dd9de400492f76,594858,,Linneo,"l nome deriva da Adone, che secondo la leggenda, ucciso da un cinghiale, venne trasformato da Afrodi","Infestante nei campi di cereali.","Presente in Europa, salvo a nord e nelle Isole Britanniche; relativamente rara per le moderne tecnic","Adonide estiva",,,Maggio,Agosto
961211,"Nigella arvensis",Specie,"Pianta annua, con radice a fittone molto lunga (50 cm), a foglie 2-3 pennatosette, laciniate; calice ridotto e cinque petali azzurrini con fiori di 3 cm di 0; frutto dato da cinque follicoli.<br /><br />La pianta è velenosa.",303c20509702a8b72d411fdb6b191391,5528785,,Linneo,"Il nome del genere deriva dal latino nìgellus= nerastro, per il colore dei semi.","Campi di cereali secchi e sassosi.","È presente nell'Europa centro-meridionale","Damigella campestre",,,Maggio,Giugno
511210,"Consolida regalis",Specie,"Pianta annua, con lunga radice fittonante, fusto di 50 em, eretto, ramificato, con infiorescenza a pannocchia; foglie laciniate pennatosette; corolla azzurra con piano unico di simmetria e sperone di 1-2 cm; frutto a un follicolo<br /><br />I petali, mescolati all'allume, forniscono colore blu; si coltiva come ornamentale; pianta velenosa. Simili a questa sono le specie del genere <em>Delphinium</em>; piante spesso perenni, caratterizzate dal frutto a due o più follicoli. Alcune si coltivano come ornamentali, ad esempio <em>D. ajacis</em> L. talvolta inselvatichita come pianta ruderale o infestante di cereali.",53fb7b8c9a384c5f9061e5f9ef48a0b6,594643,"( = Delphinium consolida L.)","S.F, Gray ","Il nome del genere deriva dal latino e sottolinea la proprietà attribuita alla pianta come cicatrizz","È infestante delle colture di cereali","Presente in tutta Europa salvo le isole,",Speronelia,,,Maggio,Giugno
951209,"Thalictrum minus",Specie,"Pianta perenne, rizomatosa o più o meno cespitosa; foglie biternate, con foglioline ellittico-ovali; infiorescenze a pannocchia, con fiori penduli, senza corolla e numerosi stami gialli; frutti ad achenio.<br /><br />La ssp. <em>saxatile</em> è propria dei prati steppici e si distingue per il colore grigio-verde delle foglie. Simile è <em>T. simplex</em> L., pigamo, erba scopaia, che presenta foglioline lanceolate ed è presente nei prati e pascoli umidi o magri dell'Europa",3439c3194ec14c50396a6074c4cef1a9,596272,,Linneo,"Il genere deriva dal nome greco con cui viene indicata la pianta.","Bordo di boschi e prati rocciosi, dalla pianura alla montagna."," La specie è presente nella maggior parte d'Europa, con numerose sottospecie a distribuzione locale.","Pigamo minore",,,Maggio,Agosto
831208,"Thalictrum simplex",Specie,,,,,,,,,,,,,
45207,"Myosurus minimus",Specie,"Pianta annua, con foglie lineari graminiformi in rosetta basale; fiori solitari a cinque petali giallo-verdastri, ricettacolo che a fruttificazione si allunga in modo vistoso.<br /><br />Pianta velenosa.",27ba5e428fc3763e51999a0937ce1bdc,486765,,Linneo,"Il nome del genere, che deriva dal greco, significa 'coda di topo', a causa della forma delle infrut","Fossi, argini, margine di campi, strade, su terreni argillosi.","Presente per lo più nell'Europa continentale, rara al sud.","Coda di topo",,,Maggio,Giugno
545206,"Herniaria glabra",Specie,"Specie annua o perenne, più o meno legnosa alla base; fusto ramoso, prostrato, con foglioli-ne opposte, obovate; fiori in fascetti terminali, privi di petali, piccolissimi (1 mm) e calice a cinque sepali; frutto a capsula.<br /><br />Un tempo aveva impieghi medicinali contro i calcoli e considerata efficace contro le ernie.<br /><br />Ricordiamo <em>H. hirsuta</em> L, simile a questa, però con foglie e sepali sparsi di peli rigidi.",bde7c2658b68d74e64acfe4e3b6b68ae,582001,,Linneo,"Il nome del genere si vuol far derivare dal latino hernia, per le pretese proprietà curative di ques","Su sabbie e ghiaie, negli ambienti ruderali, lungo le strade fino alla zona montana.","Presente nella maggior parte d'Europa, escluso il nord.",Erniaria,,,Maggio,Agosto
792205,"Scleranthus annuus",Specie,"Pianta annua o raramente bienne, con fusti di 10-20 cm, eretti, divisi in numerosi fascetti fiorali terminali; foglie lineari, opposte; fiori con petali assenti, e calice concresciuto alla base, aperto in cinque lobi acuti simili a una corolla; frutti ad achenio, chiuso tra ì sepali persistenti.<br /><br /><em>Scleranthus perennis</em> L, centograni perenne, è specie perenne più o meno legnosa alla base, con fusti prostrati lunghi fino a 20 cm; foglie lineari brevi, opposte o in fascetti; fiori in cime contratte con sepali uniti alla base e divisi in cinque lobi ottusi. Vive in ambienti sabbiosi, aridi, su suoli poveri prevalentemente silicei come pianta pioniera. Presente in tutta Europa con numerose sottospecie a distribuzione regionale.",5170b9b879ff7194da876a651f66a42d,582003,,,"Il nome del genere deriva dalle parole greche sclerós = rigido e ànthos = fiore.","Infestante, diffusa su suoli sabbiosi, sentieri, prati aridi fino alla zona montana; rara su terreni","Comune nella maggior parte d'Europa in numerose sottospecie.",Centograni,,,Marzo,Ottobre
1107204,"Spergularia rubra",Specie,"Pianta annua, a volte perenne, appena lignificata alla base, prostrata; foglie verticillate, al più fino a 2 cm; fiori pentameri a petali rosa-porporini, riuniti in cime racemose; frutto a piccola capsula.<br /><br />Il genere comprende numerose specie proprie delle coste rocciose o sabbiose e dei campi, come <em>S. segetalis</em> Don., rara infestante annuale dei cereali.",f3253245191ff4e85268c1c0606d16f0,586100,,"(L.) Presi.",,"Campi, zone calpestate, umide e argillose.","Comune in Europa dalla pianura alle zone montane.",Spergularia,,,Marzo,Luglio
590203,"Spergula arvensis",Specie,"Pianta annua, con fusti prostrato-ascendenti, più o meno ghiandolosa e pelosa; foglie lineari, verticillate, carnosette, di 1-3 cm; petali 5, obo-vati, bianchi, appena più lunghi dei sepali, fiori portati in cime racemose; frutti a capsula globosa, semi di 1-2 mm.<br /><br />La pianta è apprezzata come foraggio. I semi venivano talvolta raccolti a scopo alimentare.",e4952b1ba59ae1871acf7889dad97b87,484677,,Linneo,"Il nome del genere deriva dal latino spargere, cioè 'diffondere', per i molti semi liberati dalle ca","Campi, ambienti ruderali ricchi di sostanze azotate, prevalentemente su silice.","Presente in tutta Europa.","Renaiola comune",,,Maggio,Agosto
700202,"Polycarpon tetraphyllum",Specie,"Pianta annua, talvolta bienne, ramificata alla base con fusti di 10-15 cm, divisi in dense cime terminali; foglie in verticilli di quattro, obovate; fiori piccoli, con petali brevi e caduchi e con cinque sepali persistenti ad apice mucronato, lunghi 2 mm; capsula che si apre in tre valve.<br /><br />Il genere comprende altre specie, diffuse nell'Europa mediterranea: tra esse ricordiamo <em>P. diphyllum</em> Cav.",93dff323a7a1349c6dd5c52a6df2f800,487620,,Linneo," Il nome del genere deriva dal greco e significa 'molti frutti'; quello specifico fa riferimento ai ","Vegeta negli ambienti sabbiosi e sassosi, lungo i vecchi muri e nelle zone di calpestio.","Presente nell'Europa sud-occidentale, anche altrove naturalizzata.",Migliarina,,,Marzo,Agosto
792201,"Minuartia verna",Specie,"Pianta perenne, rizomatosa, con fusti legnosi alla base; foglie opposte, lineari, e fiori a petali bianchi interi lunghi più o meno quanto I sepali, portati in cime terminali; frutti a piccola capsula bruna.<br /><br />Comprende numerose sottospecie a distribuzione limitata, prevalentemente nelle zone montuose dell'Europa meridionale.",aec2a5deb3b1245499b252dddb6c84a7,486762," (= Alsine verna Wahlenb.)","(L) Hiern","Il genere è dedicato a J. Minuart, medico e botanico spagnolo del XVIII secolo; vernus in latino sig","Vegeta negli aridi sassosi, prevalentemente carbonatici.","Presente nell'Europa centro-meridionale.","Minuartia primaverile",,,Aprile,Agosto
696200,"Sagina procumbens",Specie,"Pianta perenne, prostrata, con rosetta basale che con i rami laterali forma un cuscinetto di 10-20 cm; foglie lineari-acute, fiori solitari a quattro sepali e quattro petali di variabile dimensione, talora assenti; frutto a capsula.<br /><br />Ricordiamo <em>S. apetala</em> Arti., simile a questa, ma annua e con fusti laterali eretti, comune. Con fiori pentameri troviamo <em>S. subulata</em> Presi., pianta perenne con cuscinetti prostrati, talvolta coltivata a scopo ornamentale per tappeti erbosi e bordure.",e3755ac6b6dbac4c4bb0988b387858eb,588073,,Linneo,"Il nome del genere deriva dal termine latino sagina, che sia a indicare un foraggio ingrassante per ","Ambienti sabbiosi, zone di calpestio, rive di ruscelli, rocce umide, dal piano fino alla zona montan","Diffusa in tutta Europa.","Sagina sdraiata",,,Aprile,Luglio
861199,"Arenaria serpyllifolia",Specie,"Pianta annua, raramente bienne, di piccole dimensioni (al più 20 cm), densamente ramificata fin dalla base; foglie ovali tondeggianti; infiorescenze a cime terminali povere, con fiori a cinque petali bianchi interi, appena più corti dei sepali verdi, acuti. Frutto a capsula ovoidale.<br /><br />Comune in tutta Europa.<br /><br />Il genere comprende molte specie di ambienti pionieri, prevalentemente in montagna.",790c5ea90b9cf29aefc5ce907efe41d0,588852,,Linneo,"Il nome del genere deriva dal latino arena cioè ","Si incontra comunemente nei campi, negli incolti aridi, su argini, sabbie, roccette e muri, dalla pi",,Arenaria,,,Marzo,Ottobre
684198,"Holosteum umbellatum",Specie,"Pianta annua, più o meno ramificata, con fusti fiorali che portano foglie opposte, ovali, sessili e infiorescenze a ombrella; corolla bianca con petali interi più lunghi dei sepali; i peduncoli fiorali si reclinano appena inizia la fruttificazione; frutto a capsula cilindrica.",8e279206b7880ffda8069c8fe4917631,488211,,Linneo,"Il nome del genere significa 'ossuto', forse per l'aspetto rigido dell'infiorescenza; quello specifi","Ambienti poveri, sabbiosi e ciottolosi; pianta pioniera, dalla pianura al piano montano","Presente e comune in Europa, soprattutto centrale, orientale e meridionale","Garofolino a ombrelle",,,Aprile,Maggio
674197,"Stellaria media",Specie,"Pianta annua o bienne, più o meno prostrata, radicante ai nodi, foglie sessili ovali, opposte; infiorescenze povere, con piccoli fiori (5 mm) a petali profondamente bilobi, più corti dei sepali verdi, liberi. Frutto a capsula.<br /><br />Può essere utilizzata come insalata primaverile; le foglie e i semi sono cibo gradito per gli uccelli.",0529b81ddceef49105c5839d3fb9d8ff,587772,,"(L.) Vill.",,"Comune come infestante nelle colture sarchiate, ruderale, nelle discariche, nei luoghi umidi e negli","Diffusa dappertutto, legata alla presenza dell'uomo.","Centocchio, paperina, budellina",,,Gennaio,Dicembre
641196,"Stellaria graminea",Specie,"Pianta perenne, con fusto tetragono, glabro; foglie llneari-lanceolate, più larghe alla base, opposte, lunghe fino a 5 cm; fiori in cime lasse, sepali e petali subeguali, ma questi ultimi profondamente divisi in due lobi (sembrano dieci). Frutto a capsula pendente,<br /><br />Talora coltivata per bordure.",aad148d66034ff71d5120f42cb0659a2,587703,,Linneo,"Il nome generico fa riferimento ai fiori dall'aspetto stellato, quello specifico alle foglie simiii ","Comune nei prati, nei campi, dalla pianura alla montagna.","Presente quasi in tutta Europa.","Centocchio gramignola",,,Maggio,Agosto
627195,"Cerastium brachypetalum",Specie,,,,,,,,,,,,,
50194,"Cerastium semidecandrum",Specie,,,,,,,,,,,,,
50193,"Cerastium holosteoides",Specie,"Pianta perennante, a breve ciclo, con numerosi gelti sterili; i sepali sono lunghi come i petali o poco più<br /><br />Fa parte di un gruppo di numerose specie e sottospecie molto simili tra loro, che si possono distinguere in base ai semi e al rapporto tra la lunghezza dei petali e dei sepali.<br /><br />Ricordiamo <em>C. semidecandrum</em> L, peverina annuale: è specie annua con foglie superiori a margine scarioso, pelali più brevi dei sepali e senza getti sterili; si ritrova in quasi tutta Europa in ambienti aridi, sabbiosi, campi e strade, dalla pianura alla montagna",a92be0dee03687e8464a12f1ae7633a5,,"( = C. caespitosum Gilib.)",Fries,"Holosteoides significa 'come osso sbiancato', per il colore della corolla o dei frutti.","Colture sarchiate, prati falciati e umidi, incolti e ruderi, dalla pianura al piano alpino.","Diffusa ovunque in Europa","Peverina dei prati",,,Aprile,Ottobre
938192,"Cerastium glomeratum",Specie,"Pianta annua, con rosetta basale, ghiandolo-sa, a foglie più o meno ovali-ellittiche, pelose, a fiori addensati.<br /><br />Simile è <em>C. brachypetalum</em> Pers., peverina a petali brevi; è pianta densamente pelosa, con infiorescenze lasse e i peduncoli fiorali lunghi 2x il calice. Si presenla di solito in gruppetti densi. È diffusa In tutta Europa con numerose sottospecie.",d5f840b6667189d5e1aebfb21587f266,588538,,Thuill.,,"Comunissima infestante delle colture e anche ruderale, frequente lungo le strade; dalla pianura fino","Presente in tutta Europa.","Peverina dei campi","Fioritura: tutto l'anno a seconda delle zone climatiche.",,,
684191,"Cerastium arvense",Specie,"Pianta perenne, con fusto rampante, radicante ai nodi; fiori grandi al più 1,5 cm, con petali lunghi 2x il calice.",0a17bc20e409fad1b7be6e9145e3bef8,589301,,,,"È specie comune negli ambienti aridi, sabbiosi e sciolti, lungo le strade o sui muri, spesso ruderal","Diffusa in tutta Europa.","Peverina a foglie strelte",,,Maggio,Agosto
