id,name,taxa_kind_id_name,description,col_id,eol_id,Sinonimi,Autore,Etimologia,"Tipo di vegetazione","Diffusione geografica","Nome italiano",Fioritura,Altezza,"Inizio fioritura","Fine fioritura"
512410,"Polygala nicaeensis",Specie,"Pianta prostrato-rampante, alta fino a 40 cm, ha foglie spatolato-lineari; i racemi ricchi portano fiori rosa o talora bianchi dì 1,5 cm, con brattee lunghe il doppio dei peduncoli fiorali.<br /><br />Un tempo aveva impieghi officinali per le proprietà pettorali, sudorifere e toniche.<br /><br />Simile alla precedente, ma con brattee florali lunghe quanto i peduncoli o meno, è <em>P. vulgaris</em> L. bozzolina, poligala comune.",af45007c5246b7f87035350b4f5ee3a4,5494825,,,,"È legata agli ambienti aridi, prati e pascoli, brughiere, costoni rocciosi fino a 800 m.","Diffusa nell'Europa meridionale e centro-meridionale.",,,,Aprile,Luglio
679408,"Linum usitatissimum",Specie,"Pianta annuale, con fusti generalmente semplici, foglie lanceolate, strette, porta fiori di 2-3 cm con corolle azzurre. La capsula è grande fino a 1 cm.<br /><br />Anticamente era coltivato ovunque per la fibra o i semi. Il lino è fin dall'antichità pianta tessile e officinale; si coltiva, meno di un tempo, per la fibra per lo più nelle regioni a clima relativamente freddo e per i semi nelle regioni a clima caldo. L'olio è usato nell'industria delle vernici, in profumeria e in medicina come lassativo. I semi, messi a bagno, servono per preparare un liquido emolliente, inoltre vengono usati per cataplasmi.<br /><br />Simile è <em>Linum bienne</em> Mill., lino selvatico, che però è specie bienne o perenne e presenta capsule lunghe fino a ½ cm.",e09f27b8070eb612bc0f6529e6caa09b,581568,,Linneo,,"Praticamente non esiste selvatica, ma è sfuggita alla coltivazione, qua e là presente fino a 1500 m nei prati e nelle chiarie.",,"Lino coltivato",,,Maggio,Luglio
1010407,"Linum bienne",Specie,,,,,,,,,,,,,
39406,"Linum tenuifolium",Specie,"Pianta perenne, lignificata alla base, alta fino a 50 cm, porta foglie lineari; le corolle sono rosa o talora bianche, con petali di 1 cm o più.",9c45b85e0850df40b1741a899e08a219,5404986,,Linneo,,"È specie diffusa nei prati aridi calcarei, negli incolti asciutti e pietrosi.","Presente in centro e sud Europa","Lino a foglie strette, L. montano",,,Maggio,Novembre
398405,"Linum viscosum",Specie,"Pianta perenne, rizomatosa, con fusti alti fino a 50 cm, vischiosi; porta foglie ellittiche a cinque nervi e fiori a petali rosa di 1,5-2 cm.",e52fd82902a78cfcbe8a6319c611f084,5405026,,Linneo,,"Si trova nei prati aridi e sui costoni secchi, nei boschi di pino fino a 1500 m.","Non troppo comune, è specie legata prevalentemente agli ambienti montani dell'Europa centro-meridionale.","Lino malvino",,,Maggio,Luglio
444404,"Linum flavum",Specie,"Pianta perenne, lignificata alla base, produce scapi fiorali annui con toglie in basso spatolate e in alto lanceolate; l'infiorescenza è ricca, con petali gialli di 2 cm.",131f642b30fab4b99c7bdf849da5f3ec,5404718,,Linneo,,"Vive nei prati aridi, sui pendii sassosi, rupi e incolti lino a 800 m.","Si trova nel centro e sud-est d'Europa.","Lino giallo",,,Giugno,Luglio
395403,"Linum catharticum",Specie,"Pianta annua, esile e glabra, alta poco più di 10 cm, porta foglioline opposte; le infiorescenze sono lasse, con fiori piccoli, bianchi.<br /><br />Un tempo era usata per le proprietà amare, purgative e antielmintiche.",6d753beb93c3494b08ae12496b23efbc,581830,,Linneo,"Le proprietà purgative sono indicate dal nome specifico.","Si incontra negli ambienti steppici, nei prati e pascoli aridi su calcare, fino al piano alpino.","È ampiamente diffusa in Europa, legata però alle parti meridionali degli ambienti montani.","Lino purgativo",,,Maggio,Luglio
589402,"Radiola linoides",Specie,"Pianta annua, delicata, con fusto densamente dicotomico, presenta foglie e fiori di piccole dimensioni; i fiori sono bianchi, formati da verticilli di quattro elementi; il frutto è una capsula subsferica.",0d79ae585ee2359d3d6d734b17baa345,579571,,Roth.,"Il nome del genere significa, dal latino, 'piccolo raggio': le valve dei frutti, infatti, si divaricano le une rispetto alle altre come raggi.","Vive su suoli sabbiosi, torbosi, in brughiere e suoli acidi fino a 1500 m.","Manca o è rara nell'Europa orientale.","Falso lino",,,Giugno,Settembre
580401,"Geranium pusillum",Specie,"Pianta annua, appena pelosa, foglie palma-to-incise e fiori violetti piccolissimi con petali coperti dai sepali; frutti pelosi di 1 cm circa.",5fd175287ed063c73bb28ba2fa45fd46,130314,,Linneo,,"Si incontra come infestante delle colture sarchiate, ma anche negli ambienti ruderali fino oltre i 1000 m.","La specie è presente in quasi tutta Europa","Geranio minore",,,Maggio,Ottobre
413400,"Geranium molle",Specie,"Pianta erbacea annua o bienne, pelosa; foglie lobate e fiori piccoli a petali bilobi violétti, più lunghi dei sepali: frutto glabro di 1 cm.",6789e74a58c096f27619fa45114e8641,130373,,Linneo,,"È presente nei prati, nei campi e nelle vigne, negli ambienti aridi fino a 1000 m","Anche questa è specie diffusa in tutta Europa e subcosmopolita","Geranio volgare",,,Marzo,Settembre
409399,"Geranium rotundifolium",Specie,"Pianta annua, ramosa, con foglie palmate a cinque lobi; fiori violetti di meno di 1 cm di ⌀; frutti di 1,5 cm.",e1e6bda1fa2dd23c5c6e272f6ddb4273,346199,,Linneo,,"Infestante delle vigne e dei campi, si trova anche negli incolti fino a 1200 m","È presente in quasi tutta Europa","Geranio malvaccino",,,Maggio,Ottobre
355398,"Geranium columbinum",Specie,,,,,,,,,,,,,
46397,"Geranium dissectum",Specie,"Pianta annua, pelosa, con foglie profondamente divise in elementi lineari; petali piccoli di 5 mm, rosa chiaro, superati dai sepali; frutto di 2 cm circa.<br /><br />Molto simile a questa specie è <em>G. columbinum</em> L. che presenta sepali di 5 mm, con petali più lunghi.",7bade52a5e11e9bea6e5cda2a9703681,130324,,Linneo,,"Si incontra nei coltivi, presso le abitazioni, negli incolti e ambienti ruderali fino a 1200 m","Diffusa quasi in tutta Europa","Geranio a foglie sette",,,Aprile,Settembre
533396,"Geranium pyrenaicum",Specie,"Erba perenne, a radice legnosa, presenta foglie vellutate, rotonde, incise, grandi fino a 7 cm di ⌀; i fiori, di 1,5-2 cm, hanno petali bilobi roseo-violetti.",10094eb68176ceb5d396c21f6f2cb65f,994363,,"Burm f.",,"È specie dei prati e pascoli, degli incolti fino al piano alpino","Diffusa nelle zone montuose dell'Europa centrale e mediterranea","Geranio dei Pirenei",,,Aprile,Luglio
420395,"Geranium pratense",Specie,"Pianta perenne, con fusti pelosi e grandi foglie palmato-partite a lobi acuti; fiori grandi fino a 3 cm, con petali azzurro-violetti o rosati",2ad094d4c1dc667caaa294a17d32a27e,130488,,Linneo,,"Vive nei prati pingui e umidi fino a 1200 m","Diffusa in Europa, soprattutto nelle zone montagnose","Geranio dei prati",,,Giugno,Agosto
361394,"Geranium robertianum",Specie,"Erba annua o perenne, con odore poco gradevole, presenta fusti arrossati e foglie palmatosette; i fiori, portati a due, hanno petali arrotondati rosa-porporini, di 1,5-2 cm di ⌀. I fruiti sono di 3 cm.<br /><br />La pianta era utilizzata per le proprietà astringenti e cicatrizzanti",fb089a2fd8976399763b530933cd6fd8,346311,,Linneo,,"Questa specie si incontra in tutti i terren soffici, umidi, in posizione ombreggiata, fino al piano montano","Presente in quasi tutta Europa","Erba roberta, erba cimicina",,,,
548393,"Erodium cicutarium",Specie,"Pianta per lo più annuale, di aspetto variabile, ha fusto breve, peloso; le foglie sono pennatosette con 9-11 foglioline ovali-partite. I fiori rosa sono portati in ombrelle terminali; i frutti sono lunghi 5 cm.",899f1009eb1d88ebd06df2eb04af4e9f,392836,,"(L.) Her.","Erodiós In greco significa 'airone' (come per Geranium si sottolinea la forma dei frutti); le foglie simili a quelle dì una ombrellifera hanno determinato il nome specifico.","Infestante e ruderale, può arrivare anche a discrete altitudini (1800 m)","La specie, presente in quasi tutta Europa, è subcosmopolita",Cicutaria,,,Marzo,Novembre
644392,"Tribulus terrestris",Specie,"Pianta annua, prostrata, pelosa, con fusti irraggiatisi diritti; le foglie opposte sono imparipennatosette di 8-14 foglioline; le corolle sono gialle, piccole, di poco più di 5 mm. I caratteristici frutti spinosi ovoidali, di 1 cm di ⌀, possono ferire i piedi scalzi; da ciò il nome volgare.",ff293b28a444c6d7bf16b4bd2c710db9,581147,,Linneo,"Il nome del genere deriva dal greco e significa 'con tre dardi', con chiaro riferimento ai frutti spinosi","È specie propria negli incolti e nelle zone sabbiose fino al piano collinare.","Diffusa nell'Europa sud-occidentale.","Tribolo, basapiè",,,Maggio,Ottobre
644390,"Oxalis dillenii",Specie,,,,,,,,,,,,,
42389,"Oxalis corniculata",Specie,"Pianta perenne o annua, prostrato-eretta, priva di stoloni, si presenta uniformemente pelosa; le foglie portano stipole e talora sono macchiate di violetto. I fiori, di 1 cm circa, sono in gruppi di 2-3; i frutti pelosi sono sostenuti da peduncoli eretti.<br /><br />Affine è <em>O. dillenii</em> Jacq. (s <em>O. strida</em> L), con aspetto cespuglioso, priva di stoloni e foglie non macchiate di rosso.",ff766a0e2d7f862b89a9054c9c1b9301,582447,,Linneo,,"Questa specie si incontra come infestante nei campi e nelle vigne, negli incolli umidi fino al piano collinare","Diffusa in quasi tutta Europa","Acetosella dei campi",,,Aprile,Giugno
672388,"Oxalis fontana",Specie,"Erba perenne, con sottile rizoma; petali gialli in fiori di 1 cm circa e frutti prismatici allungati che a maturità sono eretti e portali da peduncoli piegati a ginocchio.",25d17c219aa8292d09023761b43f3399,,"( = O. europaea Jord.)",Bunge,,"È presente come infestante e ruderale negli ambienti ricchi di sostanza nutritizia, dal piano basale fino a quello montano.","Originaria dell'America settentrionale, si è diffusa in tutto il mondo.","Acetosella minore",,,Aprile,Giugno
507386,"Vicia sativa",Specie,"Specie molto complessa, con numerose sottospecie difticili da discriminare; le foglioline sono variabili, da ellittiche a ovali-smarginate, mucronate; i fiori sono solitari o a due con corolle di 18-30 mm, di colore purpureo-violetto; il legume è pelosetto, di 3-7 cm, bruno-nerastro.<br /><br />Usata come foraggio o pianta da sovescio, è comunemente coltivata; esiste una varietà alba a fiori bianchi; la granella può essere utilizzata come mangime.",fd93b96763310bc3ef902ce2dee046cb,703227,,Linneo,,"Coltivata o spontanea ovunque, è importante foraggera e si incontra nei campi, prati, lungo i sentieri e negli incolti fino al piano montano","Comune in Europa, è subcosmopolita.","Veccia dolce",,,Marzo,Maggio
746383,"Vicia tenuissima",Specie,,,,,,,,,,,,,
43382,"Vicia tetrasperma",Specie,"Questa veccia presenta foglie con cirri spesso semplici e racemi poveri di 2-5 fiori; la corolla è quasi bianca e il legume breve (1,5 cm.) porta quattro semi<br /><br />Con legume a 6 semi è <em>V. tenuissima</em> (Bieb.) Sen. etth., veccia gracile, con 2 semi e frutti pelosi è <em>V. hirsuta</em> (L.) S.F. Gray, v. tentennina.",6c0d238d6cb53e8c5737da4b322a0714,703234,,"(L.) Schreb.",,"Infestante delle colture di cereali, presente anche nel prati, nelle siepi fino a 1000 m.","Pianta non frequentissima, ha una distribuzione subcosmopolita; manca in Europa solo nelle zone artiche.","Veccia a quattro semi",,,Aprile,Giugno
663381,"Vicia hirsuta",Specie,,,,,,,,,,,,,
40380,"Vicia tenuifolia",Specie,,,,,,,,,,,,,
43379,"Vicia cracca",Specie,"I fusti angolosi e più o meno pelosi portano racemi ricchi di fiori a corolle da blu a violetto; il legume piatto è di 2 cm<br /><br />Talora coltivata come ornamentale, è ottima mellifera<br /><br />Con foglioline lineari e fiori più grandi è <em>V. tenuifolia</em> Roth.",33591a27876ebb8bd505763fecfa88f3,704171,,Linneo,,"Vive nei prati e campi, negli ambienti ruderali e nei fossi fino al piano montano","Europa centro-settentrionale","Veccia montanina",,,Maggio,Agosto
505378,"Vicia villosa",Specie,"Pianta a fusti villosi; infiorescenze lunghe come le foglie o più; le corolle sono azzurro-violacee, talora anche con sfumature bianche o giallastre; il legume è di 3-4 cm.",0e0fb3c76043976213b998094ef8ea18,703236,,Roth.,,"Vive negli ambienti aridi e ruderali, infestante fino a 1000 m","La specie presenta una distribuzione euri-mediterranea, propria delle regioni occidentali e meridionali.","Veccia pelosa",,,Marzo,Giugno
455377,"Vicia lutea",Specie,,,,,,,,,,,,,
38376,"Vicia angustifolia",Specie,,,,,,,,,,,,,
45375,"Vicia sepium",Specie,"Le foglioline di questa specie sono variabili, da lanceolate a obovato-smarginate con un piccolo mucrone nell'incavatura della fogliolina stessa; i racemi sono poveri, con corolle di 1,5 cm azzurro-violetto; il legume, di 3 cm, è nero.<br /><br />Con foglioline lanceolate e fiori gialli è <em>V. lutea</em> L. veccia gialla.",79f3b4446a7ed46f3cacaba3f60516a0,703228,,Linneo,,"Frequente al margine dei boschi e nelle siepi, nei prati ombreggiati fino al piano montano.","Alpi ed Europa centro-settentrionale.","Veccia silvana",,,Giugno,Luglio
572373,"Lathyrus odoratus",Specie,,,,,,,,,,,,,
44372,"Lathyrus hirsutus",Specie,"Pianta annua, con asse e piccioli alati appena; foglioline in paio, lanceolate, di 8 cm; la corolla varia da azzurro a rosso, screziata; il legume, di 5 cm, è peloso.<br /><br />Con foglioline ellittico-ovall e fiori profumati è <em>L. odoratus</em> L. cicerchia odorosa.",ba69b772d0605895fc648343ebe7825f,703168,,Linneo,,"Si trova nei campi, negli incolti, lungo le vie fino oltre i 1000 m.","Diffusa nell'Europa mediterranea.","Cicerchia pelosa",,,Aprile,Luglio
498371,"Lathyrus latifolius",Specie,,,,,,,,,,,,,
46370,"Lathyrus sylvestris",Specie,"Pianta rizomatosa erbacea, con fusti alati e foglie a due foglioline lanceolate anche di 10 cm o più; le corolle, di 2 cm, sono rosso scuro; i legumi misurano 4-7 cm.<br /><br />Sono ritenute buone piante foraggere e buone mellifere.<br /><br />Specie simile è <em>L. latifolius</em> L. cicerchia a foglie larghe, che presenta foglioline ellittiche di 5 cm e corolle da 2 a 3 cm.",a0717409ff742369cdb53c33d5aa9568,,,Linneo,,"È presente nei prati aridi al bordo dei boschi, nei cedui fino oltre i 1000 m.","Presente in tutta Europa.",Cicerchione,,,Maggio,Agosto
598369,"Lathyrus tuberosus",Specie,,,,,,,,,,,,,
45368,"Lathyrus pratensis",Specie,"Pianta erbacea, perenne, con fusti eretti; foglie con due foglioline lanceolato-lineari di 2-4 cm, stipole astate alla base; le corolle gialle, di 15 mm, sono riunite in racemi; legumi di 4 cm.<br /><br />Con corolle rosa-rosso è <em>L. tuberosus</em> L. cicerchia tuberosa, con ingrossamenti rotondi nel rizoma.",3668026c6c8021bbf2dbeb747b3e9f8c,703180,,Linneo,,"Comune nei prati, lungo i sentieri e le siepi, nei boschi fino al piano alpino.","Presente in tutta Europa, è rara nell'area mediterranea","Cicerchia dei prati, erba galletta",,,Maggio,Agosto
591367,"Astragalus danicus",Specie,"Pianta perenne, villosa, simile alla precedente, con infiorescenze globose di fiori purpurei o violetti; I legumi sono ovali, di 1 cm di ⌀, con peli bianchi.",24a8828bb443d61915744ba92782e088,704259,,Retz.,,"Ambienti aridi e incolti fino al piano alpino.","Propria dell'Europa settentrionale, nella centrale è limitata alle regioni montuose.","Astragalo danese",,,Maggio,Giugno
414366,"Astragalus glycyphyllos",Specie,,,,,,,,,,,,,
50365,"Astragalus cicer",Specie,"Pianta perenne, con foglie imparipennatosette formate da elementi lineari lanceolati numerosissimi, di 1 cm ⌀ più; i fiori sono riuniti in racemi densi con corolle giallo chiaro; il legume è ovoidale, di 1 cm di ⌀, irsuto per peli neri.<br /><br />Pianta quasi glabra, a fusti prostrati, è <em>A. glycyphyllos</em> L.",c4299dadba3cda620b5108359fa9517d,704253,,Linneo,"In greco astrégalos indica sia una leguminosa, sia un ossicino angoloso; probabilmente si fa riferimento alla forma dei semi spigolosi","È diffusa negli ambienti aridi, nei prati e negli incolti fino al piano montano","Distribuita nell'Europa centro-meridionale","Astragalo, cece selvatico",,,Giugno,Luglio
715364,"Oxytropis pilosa",Specie,"Pianta perenne, a fusto lignificato alla base, che porta foglie imparipennatoselte di numerosissime foglioline lineari-ellittiche; 1 fiori, di color giallo chiaro, sono riuniti in racemi ovoidali contratti; il legume è eretto, ovale e peloso.<br /><br />Questa specie, come altri astragali, può avere un certo interesse come ornamentale nei giardini rocciosi",1bfdab5a2d3be9c5d76bd5dd776596e4,704078,,"(L.) DC","L'etimologia del nome generico si rifa al greco oxys - acuto e trópis - carena, per la forma appuntita dei petali inferiori","È specie legata agli ambienti detritici e aridi, prevalentemente montani","Distribuita nell'Europa orientale e centrale, Alpi e Penisola Balcanica","Astragalo peloso",,,Giugno,Luglio
756363,"Anthyllis vulneraria",Specie,"Pianta perenne, molto polimorfa, con foglie imparipennate con fogliolina terminale più grande delle altre; porta infiorescenze a capolino sferico di 3-4 cm. di ⌀, con calici pelosi e corolle gialle macchiate talora di rosso; anche il legume è peloso, con di solito 1 seme.<br /><br />Sono presenti numerose sottospecie a distribuzione regionale, spesso di difficile identificazione. Pianta di antico uso, ha proprietà vulnerarie e astringenti.",f6683fcfe5333dc386bc101887caed50,702863,,Linneo,"I caratteristici calici pelosi hanno dato il nome, di derivazione greca, al genere; le proprietà cicatrizzanti sono invece ricordate dal nome specifico.","Si incontra negli ambienti aridi e rocciosi, nei prati e pascoli fino al piano alpino","È presente in quasi tutta Europa",Vulneraria,,,Maggio,Agosto
840362,"Hippocrepis comosa",Specie,"Pianta perenne, con fusto legnoso alia base, foglie composte da 7-11 paia di foglioline ellittiche; infiorescenze a ombrelle contratte di 5-12 fiori con corolle gialle; legumi di 2 cm",83abae1e7ab57781ea11d6def7f2b803,703956,,Linneo,"I legumi articolati con elemento a ferro di cavallo hanno ispiralo il nome dei genere, dai greco tifppos = cavallo e orepis = calzatura.","Specie dei prati aridi, si incontra anche lungo le scarpate, i sentieri e nei boschi aridi fino al piano alpino.","È diffusa nell'Europa centro-occidentale e meridionale.","Sferracavallo comune",,,Maggio,Agosto
618361,"Coronilla vaginalis",Specie,"Piccola pianta legnosa, con fusti striscianti, foglie composte da 7-11 paia di foglioiine più o meno di 1 cm; i fiori gialli sono riuniti in ombrelle povere; il legume, di 2-4 cm, é articolalo.",48d73221168fa9f53f2898fa61cc5f45,703876,,Lam.,,"Si incontra nei prati aridi e negli ambienti rupestri lino a 1800 m circa.","Presente nell'Europa centro-meridionale, è legata prevalentemente ad ambienti prealpini e alpini.","Cornetta guainata",,,Maggio,Agosto
492360,"Coronilla varia",Specie,"Pianta perenne, a fusti prostrato-rampanti, con foglie composte da 8-11 paia di foglioline ellittiche e ombrelle di 10-20 fiori rosa; i legumi sono di 3-6 cm.<br /><br />La pianta è una buona foraggera, con pregi anche ornamentali<br /><br />Con foglie palmatosette a 7-9 elementi, coltivata per i semi e talora inselvatichita, è <em>Lupinus luteus</em> L. lupino giallo, presente negli ambienti ruderali della regione mediterranea.",f25c45e100b338d92cb5b751da9c5035,703877,,Linneo,"Il nome del genere è il diminutivo del latino corona e indica la disposizione dei fiori.","È presente nei prati stabili, sui pendii lungo i sentieri e le scarpate, nelle zone ombrose fino a 1500 m","Comune nell'Europa sud-occidentale.","Cornetta ginestrina",,,Giugno,Agosto
791359,"Onobrychis viciifolia",Specie,"Pianta perenne, un po' pubescente, con foglie composte imparipennate formate anche da 25 segmenti ellittici, appena pelosi. I fiori sono portati in lunghe infiorescenze racemose di 7- 10 cm, con corolle porporine di 1 cm circa.<br /><br />Si tratta di un buon foraggio e di una buona mellifera.",96ec20ab4ce5e36df951d9e6e47f9f16,689248,,Scop.,"Il nome del genere in greco indica 'foraggio per gli asini'","È specie diffusa negli ambienti aridi, nei prati e pascoli fino al piano alpino.","Questa pianta è presente nell'Europa occidentale, centrale e meridionale","Lupinella comune, fieno santo",,,Maggio,Agosto
649356,"Trifolium pratense",Specie,"Pianta rizomatosa, con fusti erbacei rampanti; stipole con resta e foglioline ovali maculate trasversalmente; le corolle sono rosso-violette.<br /><br />Tra gli usi officinali ricordiamo che ha proprietà espettoranti, diuretiche, antigottose ed è usata nelle malattie oculari; ai fiori si attribuiscono poteri astringenti e vulnerari.",fd8a7cb8a695e8a62b250001d537950e,703430,,Linneo,,"È comune nei prati, al bordo dei campi, lungo i fossi, negli incolti fino al piano alpino; talvolta coltivata come foraggio.",,"Trifoglino dei prati",,,Gennaio,Dicembre
591355,"Trifolium fragiferum",Specie,"Specie perenne, con fusti striscianti, presenta capolini ovali di 1-2 cm di ⌀ di fiori rosa carnicino; calice rigonfio nel frutto.",f74e146724a6cbb0ad95ca3024a4937c,703399,,Linneo,,"Prati e incolti fino a 1000 m circa.","Diffusa qua e là su tutto il continente, salvo le zone artiche.","Trifoglio fragolino",,,Aprile,Agosto
362354,"Trifolium medium",Specie,"Pianta perenne, con fusto zigzagante; foglio-line lanceolate di 4-5 cm, capolini di fiori rosso carminio.",690bafe6dc25ff65fe4bd9e42250edd0,,,Linneo,,"Si incontra nel luoghi erbosi, nei prati magri, al bordo e nelle radure dei boschi fino a 1500 m di altitudine.","Presente in gran parte d'Europa.","Trifoglio medio",,,Maggio,Agosto
364353,"Trifolium ochroleucum",Specie,"Pianta perenne, legnosa alla base, con foglio-line ellittiche setose argentate; i capolini, di 2 cm di ⌀, raccolgono fiori bianco-giallognoli.",39d498c462468e56baca16f8289da55c,11227680,,,"Ochroleucum significa 'giallo-bianco'.",Giugno,"La specie gravita prevalentemente nell'Europa orientale.","Trifoglio bianco-giallo",,,Maggio,Giugno
375352,"Trifolium montanum",Specie,"Pianta perenne, con fusto poco ramoso, finemente pubescente; foglioline lanceolate di 3 cm, pelose inferiormente, capolini di 2 cm di ⌀ con corolle bianco-latteo<br /><br />Discreta foraggera, è pianta mellifera.",a9fb37f8958cfdbeac6ae8b30e06330f,703418,,Linneo,,"È presente soprattutto nei prati fino oltre i 1500 m.","Diffusa al centro e sud dell'Europa.","Trifoglio montano",,,Maggio,Agosto
431351,"Trifolium subterraneum",Specie,"Pianta annuale, con fusti striscianti, pelosi, porta capolini poveri e formati da piccoli fiori, rivolti verso il basso; colore della corolla bianco.",8f8c6a38da45b2bd62e90338ff2e2047,703458,,Linneo,,"Specie rara, si può incontrare negli ambienti aridi e acidificati.","La pianta è presente prevalentemente nell'Europa sud-occidentale","Trifoglio sotterraneo",,,Aprile,Giugno
415350,"Trifolium repens",Specie,"Pianta perenne, con fusti striscianti e stoloniferi; foglioline ovali-rotonde e capolini di 1,5 cm di fiori bianchi, portati su brevi peduncoli.<br /><br />Ottima specie foraggera, migliora i pascoli magri.",a256342417b6d0a7f4d20d0489183b4b,703436,,Linneo,,"Diffusa ovunque nei prati, al bordo dei boschi e dei sentieri, negli incolti fino a 1000 m","È presente praticamente in tutta Europa","Trifoglio bianco, Trifoglio ladino",,,Aprile,Ottobre
478349,"Trifolium rubens",Specie,,,,,,,,,,,,,
43348,"Trifolium incarnatum",Specie,"Pianta bienne, con fusto più o meno peloso, presenta foglioline di 2 cm obovali; le corolle sono rosso intenso in spighe.<br /><br />Si tratta di una buona foraggera annuale, consumata allo stato fresco; dalle infiorescenze si può estrarre un profumo.<br /><br />Con capolini a coppie e fusti glabri è <em>Trifolium rubens</em> L. trifoglio rosseggiante.",5f4d82499e26e02f9811410217b4a1a4,703405,,Linneo,,"Pianta coltivata, si rinviene inselvatichita o spontanea nei prati fino al piano alpino.","È specie propria dell'Europa mediterranea e occidentale.","Trifoglio rosso",,,Aprile,Giugno
628347,"Trifolium arvense",Specie,"Pianta annua, eretta, diffusamente pelosa; foglioline lanceolate e caratteristici capolini ellìttici allungati, grigio-violetti, formati da fiori piccoli, bianco-rosati.",eab424abb40172678eadd8917d9a6959,703386,,Linneo,,"Cresce lungo il bordo dei sentieri e dei campi, nei luoghi sabbiosi e negli incolti fino al piano montano.","È presente in quasi tutta Europa","Pie di lepre",,,Aprile,Giugno
429346,"Trifolium campestre",Specie,"Pianta annua, con fusti ramosi pubescenti; capolini piccoli con corolle gialle poi brune.",0ae0b213d88da5ac2ff1d2fa0510ee69,703392,,Schreb,,"Presente al bordo dei campi, nei sentieri, negli incolti aridi fino al piano collinare.","Diffusa in tutta Europa","Trioglio campestre",,,Aprile,Agosto
327345,"Medicago falcata",Specie,"Simile alla precedente, con fiori bianco-giallastri e legume incurvato a falce.",1b88037e640c32cc15b3218f67dbac5e,39947262,,"(L.) Arcang.",,,,"erba medica falcata",,,,
199344,"Medicago lupulina",Specie,"Pianta annua o talora perenne, con fusti angolosi; fiori, con corolle minute, riuniti in capolini; legumi ripiegati a semicerchio di 2 mm.<br /><br />Discreta foraggera, è pianta mellifera ricercata dalle api",fe768a2a83dc35004a840afd43b8671f,646897,,,,"Si incontra negli ambienti ruderali, negli incolti aridi, sulie scarpate e bordi di campi fino a 1500 m.","È diffusa in tutta Europa.","Erba medica lupulina",,,Aprile,Luglio
462343,"Medicago orbicularis",Specie,"Pianta annua, con fusti angolosi, con fiori riuniti in racemi contratti apicali di pochi fiori (1-5), corolle gialle; legume spiralato a molla, largo e vistoso.",5e8947c370075fe3a06d4fce9559d33f,703647,,"(L.) Bartal",,"È diffusa sul bordo dei prati e dei sentieri fino a 1300 m.","Presente soprattutto nell'Europa meridionale e mediterranea.","Erba medica orbicolare",,,Aprile,Maggio
